short reference,DOI,authors,title,journal,year
"KEPEZHINSKAS, 2020",https://doi.org/10.1016/j.lithos.2019.105306,"KEPEZHINSKAS, P; KAMENOV, G D; FOSTER, D A; KEPEZHINSKAS, P","PETROLOGY AND GEOCHEMISTRY OF ALKALINE BASALTS AND GABBROIC XENOLITHS FROM UTILA ISLAND (BAY ISLANDS, HONDURAS): INSIGHTS INTO BACK - ARC PROCESSES IN THE CENTRAL AMERICAN VOLCANIC ARC",LITHOS,2020
"HOMRIGHAUSEN, 2018",https://doi.org/10.1016/j.epsl.2018.03.049,"HOMRIGHAUSEN, S; HOERNLE, K; GELDMACHER, J; WARTHO, J-A; HAUFF, F; PORTNYAGIN, M; WERNER, R; VAN DEN BOGAARD, P; GARBE-SCHÖNBERG, D",UNEXPECTED HIMU-TYPE LATE-STAGE VOLCANISM ON THE WALVIS RIDGE,EARTH AND PLANETARY SCIENCE LETTERS,2018
"HOMRIGHAUSEN, 2018",https://doi.org/10.1016/j.earscirev.2018.04.009,"HOMRIGHAUSEN, S; HOERNLE, K; HAUFF, F; GELDMACHER, J; WARTHO, J-A; VAN DEN BOGAARD, P; GARBE-SCHÖNBERG, D",GLOBAL DISTRIBUTION OF THE HIMU END MEMBER: FORMATION THROUGH ARCHEAN PLUME-LID TECTONICS,EARTH-SCIENCE REVIEWS,2018
"SIMON, 2014",https://doi.org/10.1016/j.jvolgeores.2014.09.003,"SIMON, A; YOGODZINSKI, G; ROBERTSON, K; SMITH, E; SELYANGIN, O; KIRYUKHIN, A; MULCAHY, S R; WALKER, J D","EVOLUTION AND GENESIS OF VOLCANIC ROCKS FROM MUTNOVSKY VOLCANO, KAMCHATKA",J VOLCANOL GEOTHERM RES,2014
"HATTORI, 2010",https://doi.org/10.1111/j.1440-1738.2009.00696.x,"HATTORI, K H; WALLIS, S; ENAMI, M; MIZUKAMI, T",SUBDUCTION OF MANTLE WEDGE PERIDOTITES: EVIDENCE FROM THE HIGASHI-AKAISHI ULTRAMAFIC BODY IN THE SANBAGAWA METAMORPHIC BELT,ISLAND ARC,2010
"HATTORI, 2010",https://doi.org/10.1016/j.lithos.2009.10.010,"HATTORI, K H; GUILLOT, S; SAUMER, B-M; TUBRETT, M; VIDAL, P; MORFIN, S",CORUNDUM-BEARING GARNET PERIDOTITE FROM NORTHERN DOMINICAN REPUBLIC: A METAMORPHIC PRODUCT OF AN ARC CUMULATE IN THE CARIBBEAN SUBDUCTION ZONE,LITHOS,2010
"TOLLSTRUP, 2010",https://doi.org/10.1029/2009gc002847,"TOLLSTRUP, D; GILL, J B; KENT, A J R; PRINKEY, D; WILLIAMS, R; TAMURA, Y; ISHIZUKA, O","ACROSS-ARC GEOCHEMICAL TRENDS IN THE IZU-BONIN ARC: CONTRIBUTIONS FROM THE SUBDUCTING SLAB, REVISITED",GEOCHEM GEOPHYS GEOSYST,2010
"HOERNLE, 2016",https://doi.org/10.1130/G37582.1,"HOERNLE, K; SCHWINDROFSKA, A; WERNER, R; BOGAARD, P; HAUFF, F; UENZELMANN-NEBEN, G",TECTONIC DISSECTION AND DISPLACEMENT OF PARTS OF THE SHONA HOSTSPOT VOLCANO 3500 KM ALONG THE AGULAS-FALKLAND FRACTURE ZONE,GEOLOGY,2016
"GONZALEZ-JIMENEZ, 2014",https://doi.org/10.1007/s00410-014-1047-x,"GONZALEZ-JIMENEZ, J; VILLASECA, C; GRIFFIN, W L; OREILLY, S Y; BELOUSOVA, E; ANCOCHEA, E; PEARSON, N J","SIGNIFICANCE OF ANCIENT SULFIDE PGE AND Re-Os SIGNATURES IN THE MANTLE BENEATH CALATRAVA, CENTRAL SPAIN",CONTRIB MINERAL PETROL,2014
"POLLOCK, 2009",https://doi.org/10.1029/2007jb005436,"POLLOCK, M A; KLEIN, E M; KARSON, J A; COLEMAN, D S",COMPOSITIONS OF DIKES AND LAVAS FROM THE PITO DEEP RIFT:  IMPLICATIONS FOR CRUSTAL ACCRETION AT SUPERFAST SPREADING CENTERS,J GEOPHYS RES,2009
"CHAUVEL, 1997",https://doi.org/10.1016/S0009-2541(97)00029-6,"CHAUVEL, C; MCDONOUGH, W F; GUILLE, G; MAURY, R C; DUNCAN, R A","CONTRASTING OLD AND YOUNG VOLCANISM IN RURUTU ISLAND, AUSTRAL CHAIN",CHEMICAL GEOLOGY,1997
"CAZENAVE, 2015",https://doi.org/10.1016/j.gca.2014.12.023,"CAZENAVE, A; REN, Z-Y; NICHOLS, A; SONG, M-S; QIAN, S-P; ZHANG, Y; ZHAO, P-P",PETROGENESIS OF LATE CENOZOIC BASALTS FROM NORTH HAINAN ISLAND: CONSTRAINTS FROM MELT INCLUSIONS AND THEIR HOST OLIVINES,GEOCHIM COSMOCHIM ACTA,2015
"ZHANG, 2020",https://doi.org/10.1016/j.lithos.2020.105819,"ZHANG, C; LI, C; JI, W-B; LIU, T; WU, F-Y",HETEROGENEOUS SUB-RIDGE MANTLE OF THE NEO-TETHYS: CONSTRAINTS FROM RE-OS ISOTOPE AND HSE COMPOSITIONS OF THE XIGAZE OPHIOLITES,LITHOS,2020
"ZHANG, 2020",https://doi.org/10.1016/j.lithos.2020.105385,"ZHANG, H; ZHENG, J P; ZHOU, Y; PAN, S; XIONG, Q; LIN, A; ZHAO, Y",MESOZOIC LITHOSPHERIC MODIFICATION AND REPLACEMENT BENEATH THE CATHAYSIA BLOCK: MINERAL CHEMISTRY AND WATER CONTENTS OF THE DAOXIAN PERIDOTITE XENOLITHS,LITHOS,2020
"ZHANG, 2020",https://doi.org/10.1016/j.lithos.2020.105477,"ZHANG, C; LIU, C-Z; LIU, T; WU, F-Y",EVOLUTION OF MANTLE PERIDOTITES FROM THE LUOBUSA OPHIOLITE IN THE TIBETAN PLATEAU: SR-ND-HF-OS ISOTOPE CONSTRAINTS,LITHOS,2020
"ZHANG, 2020",https://doi.org/10.1130/g47064.1,"ZHANG, J-B; LIU, Y-S; DUCEA, M N; XU, R","ARCHEAN, HIGHLY UNRADIOGENIC LEAD IN SHALLOW CRATONIC MANTLE",GEOLOGY,2020
"HERBRICH, 2016",https://doi.org/10.1016/j.gca.2016.04.036,"HERBRICH, A; HAUFF, F; HOERNLE, K; WERNER, R; GARBE-SCHÖNBERG, D; WHITE, S M",A 1.5MA RECORD OF PLUME-RIDGE INTERACTION AT THE WESTERN GALÁPAGOS SPREADING CENTER (91°40'–92°00'W),GEOCHIM COSMOCHIM ACTA,2016
"NIU, 1999",https://doi.org/10.1029/1998JB900037,"NIU, Y; COLLERSON, K D; BATIZA, R; WENDT, J I; REGELOUS, M",ORIGIN OF ENRICHED-TYPE MID-OCEAN RIDGE BASALT AT RIDGES FAR FROM MANTLE PLUMES: THE EAST PACIFIC RISE AT 11 DEG 20 MIN N,J GEOPHYS RES,1999
"PETERSON, 2017",https://doi.org/10.1093/petrology/egx059,"PETERSON, M; SAAL, A E; KURZ, M D; HAURI, E H; BLUSZTAJN, J; HARPP, K S; WERNER, R; GEIST, D J",SUBMARINE BASALTIC GLASSES FROM THE GALAPAGOS ARCHIPELAGO: DETERMINING THE VOLATILE BUDGET OF THE MANTLE PLUME,JOURNAL OF PETROLOGY,2017
"SANFILIPPO, 2016",https://doi.org/10.1130/G37428.1,"SANFILIPPO, A; MORISHITA, T; SENDA, R",RHENIUM-OSMIUM ISOTOPE FRACTIONATION IN THE OCEANIC CRUST-MANTLE BOUNDARY,GEOLOGY,2016
"RICHTER, 2020",https://doi.org/10.1126/sciadv.abb4340,"RICHTER, M; NEBEL, O; MAAS, R; MATHER, B; NEBEL-JACOBSEN, Y; CAPITANIO, F; DICK, H J B; CAWOOD, P A","AN EARLY CRETACEOUS SUBDUCTION-MODIFIED MANTLE UNDERNEATH THE ULTRASLOW SPREADING GAKKEL RIDGE, ARCTIC OCEAN",SCIENCE ADVANCES,2020
"LESNOV, 2009",https://doi.org/10.1016/j.rgg.2009.11.005,"LESNOV, F P; KOZMENKO, O A; NIKOLAEVA, I V; PALESSKII, S V",RESIDENCE OF INCOMPATIBLE TRACE ELEMENTS IN A LARGE SPINEL LHERZOLITE XENOLITH FROM ALKALI BASALT OF SHAVARYN TSARAM-1 PALEOVOLCANO (WESTERN MONGOLIA),RUSSIAN GEOL GEOPHYS,2009
"STANDISH, 1998",https://doi.org/10.1007/s004100050443,"STANDISH, J-J; GEIST, D J; HARPP, K S; KURZ, M D","THE EMERGENCE OF A GALAPAGOS SHIELD VOLCANO, ROCA REDONDA",CONTRIB MINERAL PETROL,1998
"SECCHIARI, 2020",https://doi.org/10.1016/j.lithos.2019.105338,"SECCHIARI, A; GLEISSNER, P; LI, C; GONCHAROV, A G; MILKE, R; BECKER, H; BOSCH, D; MONTANINI, A",HIGHLY SIDEROPHILE AND CHALCOPHILE ELEMENT BEHAVIOUR IN ABYSSAL-TYPE AND SUPRA-SUBDUCTION ZONE MANTLE: NEW INSIGHTS FROM THE NEW CALEDONIA OPHIOLITE,LITHOS,2020
"SECCHIARI, 2020",https://doi.org/10.1016/j.gsf.2019.04.004,"SECCHIARI, A; MONTANINI, A; BOSCH, D; MACERA, P; CLUZEL, N","SR, ND, PB AND TRACE ELEMENT SYSTEMATICS OF THE NEW CALEDONIA HARZBURGITES: TRACKING SOURCE DEPLETION AND CONTAMINATION PROCESSES IN A SSZ SETTING",GEOSCIENCE FRONTIERS,2020
"DORENDORF, 2000",https://doi.org/10.1016/s0377-0273(00)00203-1,"DORENDORF, F; CHURIKOVA, T; KOLOSKOV, A; WOERNER, G",LATE PLEISTOCENE TO HOLOCENE ACTIVITY AT BAKENING VOLCANO AND SURROUNDING MONOGENETIC CENTERS (KAMCHATKA): VOLCANIC GEOLOGY AND GEOCHEMICAL EVOLUTION,JOURNAL OF VOLCANOLOGY AND GEOTHERMAL RESEARCH,2000
"HOERNLE, 2011",https://doi.org/10.1038/ngeo1331,"HOERNLE, K; HAUFF, F; WERNER, R; VAN DEN BOGAARD, P; GIBBONS, A D; CONRAD, S; MUELLER, R D",ORIGIN OF INDIAN OCEAN SEAMOUNT PROVINCE BY SHALLOW RECYCLING OF CONTINENTAL LITHOSPHERE,NATURE GEOSCIENCE,2011
"HOERNLE, 2011",https://doi.org/10.1016/j.epsl.2011.03.032,"HOERNLE, K; HAUFF, F; KOKFELT, T F; HAASE, K M; GARBE-SCHÖNBERG, D; WERNER, R",ON- AND OFF-AXIS CHEMICAL HETEROGENEITIES ALONG THE SOUTH ATLANTIC MID-OCEAN-RIDGE (5-11 DEG S): SHALLOW OR DEEP RECYCLING OF OCEAN CRUST AND/OR INTRAPLATE VOLCANISM?,EARTH PLANET SCI LETT,2011
"BIANCHINI, 2007",https://doi.org/10.1016/j.lithos.2006.06.008,"BIANCHINI, G; BECCALUVA, L; BONADIMAN, C; NOWELL, G M; PEARSON, D G; SIENA, F; WILSON, M","EVIDENCE OF DIVERSE DEPLETION AND METASOMATIC EVENTS IN HARZBURGITE-LHERZOLITE MANTLE XENOLITHS FROM THE IBERIAN PLATE (OLOT, NE SPAIN): IMPLICATIONS FOR LITHOSPHERE ACCRETIONARY PROCESSES",LITHOS,2007
"GARAPIC, 2015",https://doi.org/10.1016/j.lithos.2015.04.010,"GARAPIC, G; JACKSON, M G; HAURI, E H; HART, S R; FARLEY, K A; BLUSZTAJN, J; WOODHEAD, J D",A RADIOGENIC ISOTOPIC (HE-SR-ND-PB-OS) STUDY OF LAVAS FROM THE PITCAIRN HOTSPOT: IMPLICATIONS FOR THE ORIGIN OF EM-1 (ENRICHED MANTLE 1),LITHOS,2015
"BIRNER, 2017",https://doi.org/10.1093/petrology/egx072,"BIRNER, S; WARREN, J M; COTTRELL, E; DAVIS, F; KELLEY, K A; FALLOON, T J",FOREARC PERIDOTITES FROM TONGA RECORD HETEROGENEOUS OXIDATION OF THE MANTLE FOLLOWING SUBDUCTION INITIATION,JOURNAL OF PETROLOGY,2017
"KONRAD, 2017",https://doi.org/10.1016/j.chemgeo.2017.12.025,"KONRAD, K; GRAHAM, D W; KENT, A J R; KOPPERS, A",SPATIAL AND TEMPORAL VARIABILITY IN MARQUESAS ISLANDS VOLCANISM REVEALED BY  3 HE/ 4 HE AND THE COMPOSITION OF OLIVINE-HOSTED MELT INCLUSIONS,CHEMICAL GEOLOGY,2017
"ODRISCOLL, 2015",https://doi.org/10.1093/petrology/egv055,"ODRISCOLL, B; WALKER, R J; DAY, J M D; ASH, R D; DALY, J S","GENERATIONS OF MELT EXTRACTION, MELT–ROCK INTERACTION AND HIGH-TEMPERATURE METASOMATISM PRESERVED IN PERIDOTITES OF THE ~497 MA LEKA OPHIOLITE COMPLEX, NORWAY",J PETROL,2015
"ANDERSON, 2018",https://doi.org/10.1029/2018gc007632,"ANDERSON, M; WANLESS, V D; SCHWARTZ, D; MCCULLY, B L; FORNARI, D J; JONES, M; SOULE, S A",SUBMARINE DEEP-WATER LAVA FLOWS AT THE BASE OF THE WESTERN GALÁPAGOS PLATFORM,"GEOCHEMISTRY, GEOPHYSICS, GEOSYSTEMS",2018
"MAZZA, 2019",https://doi.org/10.1038/s41586-019-1183-6,"MAZZA, S; GAZEL, E; BIZIMIS, M; MOUCHA, R; BEGUELIN, P; JOHNSON, E; MCALEER, R; SOBOLEV, A V",SAMPLING THE VOLATILE-RICH TRANSITION ZONE BENEATH BERMUDA,NATURE,2019
"GREAU, 2011",https://doi.org/10.1016/j.gca.2011.08.035,"GREAU, Y; HUANG, J-X; GRIFFIN, W L; RENAC, C; ALARD, O; OREILLY, S Y",TYPE 1 ECLOGITES FROM ROBERTS VICTOR KIMBERLITES: PRODUCTS OF EXTENSIVE MANTLE METASOMATISM,GEOCHIM COSMOCHIM ACTA,2011
"COOPER, 2007",https://doi.org/10.2973/odp.proc.sr.206.010.2007,"COOPER, K M","DATA REPORT: TRACE ELEMENT ANALYSES IN WHOLE-ROCK BASEMENT SAMPLES, SITE 1256, ODP LEG 206.","PROC ODP, SCI RESULTS",2007
"ZHU, 2020",https://doi.org/10.1016/j.gca.2019.12.004,"ZHU, H; DU, L; LI, X; ZHANG, Z; SUN, W-D",CALCIUM ISOTOPIC FRACTIONATION DURING PLATE SUBDUCTION: CONSTRAINTS FROM BACK-ARC BASIN BASALTS,GEOCHIMICA ET COSMOCHIMICA ACTA,2020
"ERZINGER, 1985",https://doi.org/10.2973/dsdp.proc.92.128.1986,"ERZINGER, J","BASEMENT GEOCHEMISTRY, LEG 92",INIT REP DSDP,1985
"MILLER, 2004",https://doi.org/10.2973/odp.proc.sr.187.206.2004,"MILLER, D J; KELLEY, J",LOW-TEMPERATURE ALTERATION OF BASALT OVER TIME:  A SYNTHESIS OF RESULTS FROM OCEAN DRILLING PROGRAM LEG 187,"PROC ODP, SCI RESULTS",2004
"CHEN, 2017",https://doi.org/10.1016/j.jvolgeores.2017.09.024,"CHEN, S-S; LIU, J-Q; LEE, S-G; MENG, F","MINERAL AND GEOCHEMICAL CHARACTERISTICS FOR JURASSIC VOLCANIC ROCKS FROM ODP SITE 801C IN THE PIGAFETTA BASIN, WESTERN PACIFIC OCEAN: IMPLICATIONS FOR MAGMATIC EVOLUTION AT THE OLDEST FAST-SPREADING RIDGE",JOURNAL OF VOLCANOLOGY AND GEOTHERMAL RESEARCH,2017
"TODD, 2012",https://doi.org/10.1016/j.epsl.2012.05.006,"TODD, E; GILL, J B; PEARCE, J A","A VARIABLY ENRICHED MANTLE WEDGE AND CONTRASTING MELT TYPES DURING ARC STAGES FOLLOWING SUBDUCTION INITIATION IN FIJI AND TONGA, SOUTHWEST PACIFIC",EARTH PLANET SCI LETT,2012
"YU, 2019",https://doi.org/10.1016/j.epsl.2019.116002,"YU, X; DICK, H J B","PLATE-DRIVEN MICRO-HOTSPOTS AND THE EVOLUTION OF THE DRAGON FLAG MELTING ANOMALY, SOUTHWEST INDIAN RIDGE",EARTH AND PLANETARY SCIENCE LETTERS,2019
"GARRIDO, 2000",https://doi.org/10.1016/s0012-821x(00)00201-6,"GARRIDO, C J; BODINIER, J-L; ALARD, O",INCOMPATIBLE TRACE ELEMENT PARTITIONING AND RESIDENCE IN ANHYDROUS SPINEL PERIDOTITES AND WEBSTERITES FROM THE RONDA OROGENIC PERIDOTITE,EARTH PLANET SCI LETT,2000
"JICHA, 2018",https://doi.org/10.1016/j.jvolgeores.2018.06.016,"JICHA, B; KAY, S M",QUANTIFYING ARC MIGRATION AND THE ROLE OF FOREARC SUBDUCTION EROSION IN THE CENTRAL ALEUTIANS,JOURNAL OF VOLCANOLOGY AND GEOTHERMAL RESEARCH,2018
"DOUCELANCE, 2003",https://doi.org/10.1016/S0016-7037(03)00161-3,"DOUCELANCE, R; ESCRIG, S; MOREIRA, M; GARIEPY, C; KURZ, M D",Pb-Sr-He ISOTOPE AND TRACE ELEMENT GEOCHEMISTRY OF THE CAPE VERDE ARCHIPELAGO,GEOCHIM COSMOCHIM ACTA,2003
"KIMURA, 2010",https://doi.org/10.1029/2010GC003050,"KIMURA, J-I; KENT, A J R; ROWE, M C; KATAKUSE, M; NAKANO, F; HACKER, B R; VAN KEKEN, P E; KAWABATA, H; STERN, R J",ORIGIN OF CROSS-CHAIN GEOCHEMICAL VARIATION IN QUATERNARY LAVAS FROM THE NORTHERN IZU ARC: USING A QUANTITATIVE MASS BALANCE APPROACH TO IDENTIFY MANTLE SOURCES AND MANTLE WEDGE PROCESSES,GEOCHEM GEOPHYS GEOSYST,2010
"WEIS, 2002",https://doi.org/10.1093/petrology/43.7.1287,"WEIS, D; FREY, F A",SUBMARINE BASALTS OF THE NORTHERN KERGUELEN PLATEAU: INTERACTION BETWEEN THE KERGUUELEN PLUME AND THE SOUTHEAST INDIAN RIDGE REVEALED AT ODP SITE 1140,J PETROL,2002
"ZHANG, 2013",https://doi.org/10.1016/j.epsl.2013.09.045,"ZHANG, G-L; CHEN, L-H; LI, S-Z",MANTLE DYNAMICS AND GENERATION OF A GEOCHEMICAL MANTLE BOUNDARY ALONG THE EAST PACIFIC RIDGE-PACIFIC/ANTARCTIC RIDGE,EARTH PLANET SCI LETT,2013
"GIBSON, 2010",https://doi.org/10.1016/j.epsl.2010.10.002,"GIBSON, S A; GEIST, D J",GEOCHEMICAL AND GEOPHYSICAL ESTIMATES OF LITHOSPHERIC THICKNESS VARIATION BENEATH GALÁPAGOS,EARTH PLANET SCI LETT,2010
"GEORGE, 2004",https://doi.org/10.1093/petrology/egg086,"GEORGE, R; TURNER, S; HAWKESWORTH, C J; BACON, C; NYE, C L; STELLING, P; DREHER, S T",CHEMICAL VERSUS TEMPORAL CONTROLS ON THE EVOLUTION OF THOLEIITIC AND CALC-ALKALINE MAGMAS AT TWO VOLCANOES IN THE ALASKA-ALEUTIAN ARC,J PETROL,2004
"UYSAL, 2012",https://doi.org/10.1016/j.lithos.2011.11.009,"UYSAL, I; ERSOY, E; KARSH, O; DILEK, Y; SADIKLAR, M; OTTLEY, C J; TIEPOLO, M; MEISEL, T","COEXISTENCE OF ABYSSAL AND ULTRA-DEPLETED SSZ TYPE MANTLE PERIDOTITES IN A NEO-TETHYAN OPHIOLITE IN SW TURKEY: CONSTRAINTS FROM MINERAL COMPOSITION, WHOLE-ROCK GEOCHEMISTRY (MAJOR–TRACE–REE–PGE), AND RE–OS ISOTOPE SYSTEMATICS",LITHOS,2012
"KURZ, 1999",https://doi.org/10.1016/s0016-7037(99)00314-2,"KURZ, M D; GEIST, D J",DYNAMICS OF THE GALAPAGOS HOTSPOT FROM HELIUM ISOTOPE GEOCHEMISTRY,GEOCHIM COSMOCHIM ACTA,1999
"CARTIGNY, 2008",https://doi.org/10.1016/j.epsl.2007.11.011,"CARTIGNY, P; PINEAU, F; AUBAD, C; JAVOY, M","TOWARDS A CONSISTENT MANTLE CARBON FLUX ESTIMATE: INSIGHTS FROM VOLATILE SYSTEMATICS (H2O/CE, D, CO2/NB) IN THE NORTH ATLANTIC MANTLE (14° N AND 34° N)",EARTH PLANET SCI LETT,2008
"SECCHIARI, 2016",https://doi.org/10.1016/j.lithos.2016.04.030,"SECCHIARI, A; MONTANINI, A; BOSCH, D; MACERA, P; CLUZEL, N",MELT EXTRACTION AND ENRICHMENT PROCESSES IN THE NEW CALEDONIA LHERZOLITES: EVIDENCE FROM GEOCHEMICAL AND SR-ND ISOTOPE DATA,LITHOS,2016
"LUTTINEN, 2018",https://doi.org/10.1038/s41598-018-23661-3,"LUTTINEN, A",BILATERAL GEOCHEMICAL ASYMMETRY IN THE KAROO LARGE IGNEOUS PROVINCE,SCIENTIFIC REPORTS,2018
"LIANG, 2017",https://doi.org/10.1016/j.gca.2016.11.023,"LIANG, Y-H; HALLIDAY, A N; SIEBERT, C; FITTON, J G; BURTON, K W; WANG, K-L; HARVEY, J",MOLYBDENUM ISOTOPE FRACTIONATION IN THE MANTLE,GEOCHIM COSMOCHIM ACTA,2017
"SPARKS, 1995",https://doi.org/10.2973/odp.proc.sr.137140.021.1995,"SPARKS, J W","GEOCHEMISTRY OF THE LOWER SHEETED DIKE COMPLEX, HOLE 504B, LEG 140","PROC ODP, SCI RESULTS",1995
"HERGT, 1994",https://doi.org/10.2973/odp.proc.sr.135.144.1994,"HERGT, J M; NILSSON FARLEY, K","MAJOR ELEMENT, TRACE ELEMENT, AND ISOTOPE (PB, SR, AND ND) VARIATIONS IN SITE 834 BASALTS: IMPLICATIONS FOR THE INITIATION OF BACKARC OPENING","PROC ODP, SCI RESULTS",1994
"HERGT, 1994",https://doi.org/10.2973/odp.proc.sr.135.142.1994,"HERGT, J M; HAWKESWORTH, C J","PB-, SR-, AND ND-ISOTOPIC EVOLUTION OF THE LAU BASIN: IMPLICATIONS FOR MANTLE DYNAMICS DURING BACKARC OPENING","PROC ODP, SCI RESULTS",1994
"CHEN, 2012",https://doi.org/10.1080/00206814.2012.704674,"CHEN, Z-Q; ZHOU, H-Y; LIU, Y; YANG, Q-H; LI, J-W; DICK, H J B","INFLUENCE OF IGNEOUS PROCESSES AND SERPENTINIZATION ON GEOCHEMISTRY OF THE LOGATCHEV MASSIF HARZBURGITES (14 DEGREES 45 N, MID-ATLANTIC RIDGE) AND COMPARISON WITH GLOBAL ABYSSAL PERIDOTITES",INT GEOL REV,2012
"OOTES, 2019",https://doi.org/10.1016/j.lithos.2019.105220,"OOTES, L; SANDEMAN, H; COUSENS, B L; LUO, Y; PEARSON, D G; JACKSON, V",PYROXENITIC MAGMA CONDUITS (CA. 1.86 GA) IN WOPMAY OROGEN AND SLAVE CRATON: PETROGENETIC CONSTRAINTS FROM WHOLE ROCK AND MINERAL CHEMISTRY,LITHOS,2019
"TEASDALE, 2004",https://doi.org/10.1007/s00445-004-0371-9,"TEASDALE, R; GEIST, D J; KURZ, M D","1998 ERUPTION AT VOLCAN CERRO AZUL, GALAPAGOS ISLANDS: I. SYN-ERUPTIVE PETROGENESIS",BULL VOLCANOL,2004
"SEIFERT, 1996",https://doi.org/10.2973/odp.proc.sr.149.221.1996,"SEIFERT, K E; GIBSON, I L; WEIS, D; BRUNOTTE, D","GEOCHEMISTRY OF METAMORPHOSED CUMULATE GABBROS FROM HOLE 900A, IBERIA ABYSSAL PLAIN","PROC ODP, SCI RESULTS",1996
"SEIFERT, 1996",https://doi.org/10.2973/odp.proc.sr.149.216.1996,"SEIFERT, K E; BRUNOTTE, D",GEOCHEMISTRY OF SERPENTINIZED MANTLE PERIDOTITE FROM SITE 897 IN THE IBERIA ABYSSAL PLAIN,"PROC ODP, SCI RESULTS",1996
"SEIFERT, 1996",https://doi.org/10.2973/odp.proc.sr.149.225.1996,"SEIFERT, K E; BRUNOTTE, D",GEOCHEMISTRY OF WEATHERED MID-OCEAN RIDGE BASALT AND DIABASE CLASTS FROM HOLE 899B IN THE IBERIA ABYSSAL PLAIN,"PROC ODP, SCI RESULTS",1996
"HUSEN, 2016",https://doi.org/10.1016/j.gca.2016.02.031,"HUSEN, A; KAMENETSKY, V S; EVERARD, J L; KAMENETSKY, M B","TRANSITION FROM ULTRA-ENRICHED TO ULTRA-DEPLETED PRIMARY MORB MELTS IN A SINGLE VOLCANIC SUITE (MACQUARIE ISLAND, SW PACIFIC): IMPLICATIONS FOR MANTLE SOOURCE, MELTING PROCESS AND PLUMBING SYSTEM",GEOCHIM COSMOCHIM ACTA,2016
"GODARD, 2000",https://doi.org/10.1016/s0012-821x(00)00149-7,"GODARD, M; JOUSSELIN, D; BODINIER, J-L",RELATIONSHIPS BETWEEN GEOCHEMISTRY AND STRUCTURE BENEATH A PALAEO-SPREADING CENTRE: A STUDY OF THE MANTLE SECTION IN THE OMAN OPHIOLITE,EARTH AND PLANETARY SCIENCE LETTERS,2000
"LEAT, 2000",https://doi.org/10.1093/petrology/41.6.845,"LEAT, P T; LIVERMORE, R A; MILLAR, I L; PEARCE, J A","MAGMA SUPPLY IN BACK-ARC SPREADING CENTRE SEGMENT E2, EAST SCOTIA RIDGE",J PETROL,2000
"MCGUIRE, 1994",https://doi.org/10.1029/94jb01184,"MCGUIRE, A V","SOUTHERN BASIN AND RANGE PROVINCE CRUST-MANTLE BOUNDARY:  EVIDENCE FROM GABBROIC XENOLITHS, WIKIEUP, ARIZONA",J GEOPHYS RES,1994
"YAO, 2019",https://doi.org/10.1016/j.lithos.2019.04.019,"YAO, J-H; ZHU, W-G; LI, C; ZHONG, H; YU, S-Y; RIPLEY, E; BAI, Z-J","OLIVINE O ISOTOPE AND TRACE ELEMENT CONSTRAINTS ON SOURCE VARIATION OF PICRITES IN THE EMEISHAN FLOOD BASALT PROVINCE, SW CHINA",LITHOS,2019
"REAGAN, 2010",https://doi.org/10.1029/2009GC002871,"REAGAN, M K; ISHIZUKA, O; STERN, R J; KELLEY, K A; OHARA, Y; BLICHERT-TOFT, J; BLOOMER, S H; CASH, J; FRYER, P; HANAN, B B; HICKEY-VARGAS, R; ISHII, T; KIMURA, J-I; PEATE, D W; ROWE, M C; WOODS, M",FORE-ARC BASALTS AND SUBDUCTION INITIATION IN THE IZU-BONIN MARIANA SYSTEM,GEOCHEM GEOPHYS GEOSYST,2010
"ISHIZUKA, 2009",https://doi.org/10.1016/j.chemgeo.2009.06.014,"ISHIZUKA, O; YUASA, M; TAYLOR, R N; SAKAMOTO, I K",TWO CONTRASTING MAGMATIC TYPES COEXIST AFTER THE CESSATION OF BACK-ARC SPREADING,CHEMICAL GEOLOGY,2009
"RAJESH, 2013",https://doi.org/10.1016/j.precamres.2012.08.004,"RAJESH, V; ARAI, S; SATISH-KUMAR, M; SANTOSH, M; TAMURA, A",HIGH-MG LOW-NI OLIVINE CUMULATES FROM A PAN-AFRICAN ACCRETIONARY BELT IN SOUTHERN INDIA: IMPLICATIONS FOR THE GENESIS OF VOLATILE-RICH HIGH-MG MELTS IN SUPRASUBDUCTION SETTING,PRECAMBRIAN RESEARCH,2013
"KRIENITZ, 2011",https://doi.org/10.1016/j.chemgeo.2010.11.015,"KRIENITZ, M S; HAASE, K M",THE EVOLUTION OF THE ARABIAN LOWER CRUST AND LITHOSPHERIC MANTLE-GEOCHEMICAL CONTRAINTS FROM SOUTHERN SYRIAN MAFIC AND ULTRAMAFIC XENOLITHS,CHEMICAL GEOLOGY,2011
"YAN, 2015",https://doi.org/10.1016/j.lithos.2014.12.023,"YAN, Q; CASTILLO, P R; SHI, X; WANG, L; LIAO, L; REN, J",GEOCHEMISTRY AND PETROGENESIS OF VOLCANIC ROCKS FROM DAIMAO SEAMOUNT (SOUTH CHINA SEA) AND THEIR TECTONIC IMPLICATIONS,LITHOS,2015
"YANG, 2018",https://doi.org/10.1029/2018gc007593,"YANG, S; HUMAYUN, M; SALTERS, V J M",ELEMENTAL SYSTEMATICS IN MORB GLASSES FROM THE MID-ATLANTIC RIDGE,"GEOCHEMISTRY, GEOPHYSICS, GEOSYSTEMS",2018
"BORGHINI, 2020",https://doi.org/10.1016/j.chemgeo.2019.07.027,"BORGHINI, G; RAMPONE, E; ZANETTI, A; CLASS, C; FUMAGALI, P; GODARD, M",LIGURIAN PYROXENITE-PERIDOTITE SEQUENCES (ITALY) AND THE ROLE OF MELT-ROCK REACTION IN CREATING ENRICHED-MORB MANTLE SOURCES,CHEMICAL GEOLOGY,2020
"SANTOSH, 2020",https://doi.org/10.1016/j.precamres.2020.105710,"SANTOSH, M; GAO, P; YU, B; YANG, C-X; KWON, S",NEOARCHEAN SUPRASUBDUCTION ZONE OPHIOLITE DISCOVERED FROM THE MIYUN COMPLEX: IMPLICATIONS FOR ARCHEAN–PALEOPROTEROZOIC WILSON CYCLE IN THE NORTH CHINA CRATON,PRECAMBRIAN RESEARCH,2020
"SALVIOLI-MARIANI, 2005",https://doi.org/10.1016/j.lithos.2004.12.001,"SALVIOLI-MARIANI, E; RENZULLI, A; SERRI, G; HOLM, P M; TOSCANI, L",GLASS-BEARING CRUSTAL XENOLITHS (BUCHITES) ERUPTED DURING THE RECENT ACTIVITY OF STROMBOLI (AEOLIAN ISLANDS),LITHOS,2005
"BACH, 2003",https://doi.org/10.1029/2002gc000419,"BACH, W; PEUCKER-EHRENBRINK, B; HART, S R; BLUSZTAJN, J",GEOCHEMISTRY OF HYDROTHERMALLY ALTERED OCEANIC CRUST: DSDP/ODP HOLE 504B - IMPLICATIONS FOR SEAWATER-CRUST EXCHANGE BUDGETS AND SR- AND ISOTOPTC EVOLUTION OF THE MANTLE,GEOCHEM GEOPHYS GEOSYST,2003
"PAQUET, 2022",https://doi.org/10.1016/j.gca.2021.09.033,"PAQUET, M; DAY, J M D; WATERS, C",EFFECTIVE GLOBAL MIXING OF THE HIGHLY SIDEROPHILE ELEMENTS INTO EARTH’S MANTLE INFERRED FROM OCEANIC ABYSSAL PERIDOTITES,GEOCHIMICA ET COSMOCHIMICA ACTA,2022
"GAO, 2012",https://doi.org/10.1029/2012GC004207,"GAO, Y; VILS, F; COOPER, K M; BANERJEE, N R; HARRIS, M; HOEFS, J E; TEAGLE, D A H; CASEY, J F; ELLIOTT, T; LAVERNE, C; ALT, J C; MUEHLENBACHS, K","DOWNHOLE VARIATION OF LITHIUM AND OXYGEN ISOTOPIC COMPOSITIONS OF OCEANIC CRUST AT EAST PACIFIC RISE, ODP SITE 1256",GEOCHEM GEOPHYS GEOSYST,2012
"WATERS, 2011",https://doi.org/10.1093/petrology/egq091,"WATERS, C; SIMS, K W W; PERFIT, M R; BLICHERT-TOFT, J; BLUSZTAJN, J",PERSPECTIVE ON THE GENESIS OF E-MORB FROM CHEMICAL AND ISOTOPIC HETEROGENEITY AT 9DEG10MIN N EAST PACIFIC RISE,J PETROL,2011
"CHOI, 2017",https://doi.org/10.1016/j.lithos.2017.04.006,"CHOI, H-O; CHOI, S-H; SCHIANO, P; CHO, M; CLUZEL, N; DEVIDAL, J-L; HA, K",GEOCHEMISTRY OF OLIVINE-HOSTED MELT INCLUSIONS IN THE BAEKDUSAN (CHANGBAISHAN) BASALTS: IMPLICATIONS FOR RECYCLING OF OCEANIC CRUSTAL MATERIALS INTO THE MANTLE SOURCE,LITHOS,2017
"MIYAZAKI, 2020",https://doi.org/10.1029/2020gc009114,"MIYAZAKI, T; GILL, J B; HAMELIN, C; DEBARI, S; SATO, T; TAMURA, Y; KIMURA, J-I; VAGLAROV, B; CHANG, Q; SENDA, R; HARAGUCHI, S",THE FIRST 10 MILLION YEARS OF REAR‐ARC MAGMAS FOLLOWING BACKARC BASIN FORMATION BEHIND THE IZU ARC,"GEOCHEMISTRY, GEOPHYSICS, GEOSYSTEMS",2020
"LE VOYER, 2014",https://doi.org/10.1002/2014JB011160,"LE VOYER, M; COTTRELL, E; KELLEY, K A; BROUNCE, M; HAURI, E H",THE EFFECT OF PRIMARY VERSUS SECONDARY PROCESSES ON THE VOLATILE CONTENT OF MORB GLASSES: AN EXAMPLE FROM THE EQUATORIAL MID-ATLANTIC RIDGE (5°N-3°S),J GEOPHYS RES,2014
"SHELDRICK, 2020",https://doi.org/10.1016/j.lithos.2020.105747,"SHELDRICK, T; HAHN, G; DUCEA, M N; STOICA, A; CONSTENIUS, K; HEIZLER, M T","PERIDOTITE VERSUS PYROXENITE INPUT IN MONGOLIAN MESOZOIC-CENOZOIC LAVAS, AND DYKES",LITHOS,2020
"CHEN, 2016",https://doi.org/10.1007/s11001-016-9292-1,"CHEN, L; TANG, L-M; YU, X; DONG, Y-H","MANTLE SOURCE HETEROGENEITY AND MAGMATIC EVOLUTION AT CARLSBERG RIDGE (3.7°N): CONSTRAINS FROM ELEMENTAL AND ISOTOPIC (SR, ND, PB) DATA",MARINE GEOPHYS RES,2016
"GUDELIUS, 2018",https://doi.org/10.1093/petrology/egy112,"GUDELIUS, D; AULBACH, S; BRAGA, R; HOEFER, H; WOODLAND, A B; GERDES, A","ELEMENT TRANSFER AND REDOX CONDITIONS IN CONTINENTAL SUBDUCTION ZONES: NEW INSIGHTS FROM PERIDOTITES OF THE ULTEN ZONE, N ITALY",JOURNAL OF PETROLOGY,2018
"KUSANO, 2016",https://doi.org/10.1016/j.chemgeo.2016.12.012,"KUSANO, Y; UMINO, S; SHINJO, R; IKEI, A; ADACHI, Y; MIYASHITA, S; ARAI, S",CONTRIBUTION OF SLAB-DERIVED FLUID AND SEDIMENTARY MELT IN THE INCIPIENT ARC MAGMAS WITH DEVELOPMENT OF THE PALEO-ARC IN THE OMAN OPHIOLITE,CHEMICAL GEOLOGY,2016
"SUN, 2003",https://doi.org/10.1130/g19832.1,"SUN, W; ARCULUS, R J; BENNETT, V C; EGGINS, S M; BINNS, R A",EVIDENCE FOR RHENIUM ENRICHMENT IN THE MANTLE WEDGE FROM SUBMARINE ARC-LIKE VOLCANIC GLASSES (PAPUA NEW GUINEA),GEOLOGY,2003
"SUN, 2003",https://doi.org/10.1016/S0009-2541(02)00416-3,"SUN, W; BENNETT, V C; EGGINS, S M; ARCULUS, R J; PERFIT, M R",RHENIUM SYSTEMATICS IN SUBMARINE MORB AND BACK-ARC BASIN GLASSES: LASER ABLATION ICP-MS RESULTS,CHEMICAL GEOLOGY,2003
"RONGA, 2009",https://doi.org/10.1007/s00710-009-0064-3,"RONGA, F; LUSTRINO, M; MARZOLI, A; MELLUSO, L",PETROGENESIS OF A BASALT-COMENDITE-PANTELLERITE ROCK SUITE: THE BOSETI VOLCANIC COMPLEX (MAIN ETHIOPIAN RIFT),MINERALOGY AND PETROLOGY,2009
"JACKSON, 2015",https://doi.org/10.1002/2015gc005966,"JACKSON, M G; KOGA, K T; PRICE, A A ; KONTER, J G; KOPPERS, A; FINLAYSON, V A; KONRAD, K; HAURI, E H; KYLANDER-CLARK, A; KELLEY, K A; KENDRICK, M A","DEEPLY DREDGED SUBMARINE HIMU GLASSES FROM THE TUVALU ISLANDS, POLYNESIA: IMPLICATIONS FOR VOLATILE BUDGETS OF RECYCLED OCEANIC CRUST",GEOCHEM GEOPHYS GEOSYST,2015
"JACKSON, 2015",https://doi.org/10.1016/j.chemgeo.2015.08.014,"JACKSON, M G; CABRAL, R; ROSE-KOGA, E; KOGA, K T; PRICE, A A ; HAURI, E H; MICHAEL, P J",ULTRA-DEPLETED MELTS IN OLIVINE-HOSTED MELT INCLUSIONS FROM THE ONTONG JAVA PLATEAU,CHEMICAL GEOLOGY,2015
"BECCALUVA, 2004",https://doi.org/10.1016/j.lithos.2003.12.015,"BECCALUVA, L; BIANCHINI, G; BONADIMAN, C; SIENA, F; VACCARO, C",COEXISTING ANOROGENIC AND SUBDUCTION-RELATED METASOMATISM IN MANTLE XENOLITHS FROM THE BELTIC CORDILLERA (SOUTHERN SPAIN),LITHOS,2004
